{
  "$schema": "http://json-schema.org/draft-07/schema#",
  "title": "Gravity Item Definition",
  "type": "object",
  "properties": {
    "name": {
      "type": "string",
      "description": "Visual display name of the item."
    },
    "type": {
      "type": "string",
      "enum": [
        "Weapon",
        "Spell",
        "Armor",
        "Consumable",
        "Special",
        "Flavour"
      ],
      "description": "The dynamic item classification."
    },
    "description": {
      "type": "string",
      "description": "Flavour/lore text rendered in the inventory card."
    },
    "value": {
      "type": "integer",
      "minimum": 0,
      "description": "Gold purchase value. Reselling fetches half value by default."
    },
    "slot": {
      "type": "string",
      "enum": [
        "Head",
        "Amulet",
        "Torso",
        "Left Hand",
        "Right Hand",
        "Legs"
      ],
      "description": "The equipment slot target for armor and accessories. Ignored for weapons and spells — they always go to a hand, alternating left and right."
    },
    "attributes": {
      "type": "object",
      "description": "Custom parameter extensions depending on item type.",
      "properties": {
        "attackAttribute": {
          "type": "string",
          "description": "Attribute added to this weapon/spell's hit rolls (e.g. \"strength\", \"intelligence\"). The attacker's value applies — player or enemy."
        },
        "damageRoll": {
          "type": "string",
          "pattern": "^((\\d+)d(\\d+)([\\+\\-]\\d+)?|\\d+\\-\\d+)$",
          "description": "Damage formula: Standard NdF[+/-M] (e.g. '1d6+1') or range (e.g. '1-4')."
        },
        "damageAttribute": {
          "type": "string",
          "description": "Attribute added to this weapon/spell's damage rolls (e.g. \"intelligence\"). The wielder's value applies — player or enemy."
        },
        "targets": {
          "oneOf": [
            {
              "type": "string",
              "enum": [
                "all"
              ]
            },
            {
              "type": "integer",
              "minimum": 2
            }
          ],
          "description": "Multi-target attack: one hit roll compared against each target's AC, every enemy caught taking its own damage roll. \"all\" strikes every living enemy with one click; an integer splashes from the enemy the player attacks — the blast centers on them and catches neighbours in encounter order, up to that many. Omit for a single-target attack."
        },
        "grantsSpells": {
          "type": "array",
          "items": {
            "type": "string"
          },
          "minItems": 1,
          "description": "Item IDs of Spell items this item grants while equipped. A granted spell is castable without occupying a hand, and leaves the attack list on unequip. Its charges are the spell's own — a spell granted by two sources still draws from one pool."
        },
        "armorClassBonus": {
          "type": "integer",
          "description": "Flat AC protection added when equipped. Used for Armor."
        },
        "attributeBonuses": {
          "type": "object",
          "description": "Attribute deltas applied while equipped and removed on unequip (e.g. { \"perception\": 1 }). Keys must be declared attributes.",
          "additionalProperties": {
            "type": "integer"
          }
        },
        "healingAmount": {
          "type": [
            "integer",
            "string"
          ],
          "description": "HP restored on consumption. Supports flat numbers or dice notation."
        },
        "teleportScene": {
          "type": "string",
          "description": "Scene ID to teleport to upon usage. Used for consumable items."
        },
        "actionPoints": {
          "type": "integer",
          "minimum": 0,
          "description": "Action Points (AP) required to swing/equip/use inside combat."
        },
        "uses": {
          "type": "object",
          "description": "Rest-limited uses (simplified spell slots): the item can be used at most max times between rests. Omit for an unlimited item.",
          "properties": {
            "max": {
              "type": "integer",
              "minimum": 1,
              "description": "Uses available between rests."
            },
            "refresh": {
              "type": "string",
              "enum": [
                "short_rest",
                "full_rest"
              ],
              "description": "The rest that restores the uses. A full rest always restores everything; \"short_rest\" additionally restores them on a short rest. Defaults to \"full_rest\"."
            }
          },
          "required": [
            "max"
          ],
          "additionalProperties": false
        },
        "reputation": {
          "type": "integer",
          "minimum": 0,
          "description": "Reputation value. Contributes to player's reputation upon acquisition and museum's reputation when placed in display cases."
        }
      },
      "additionalProperties": false
    }
  },
  "required": [
    "name",
    "type"
  ],
  "additionalProperties": false
}
