{
  "name": "Flames",
  "type": "Spell",
  "slot": "Right Hand",
  "description": "Conjure a burst of raw fire. Requires no weapon to cast.",
  "value": 100,
  "attributes": {
    "damageRoll": "2d6",
    "attackAttribute": "intelligence",
    "actionPoints": 2,
    "uses": {
      "max": 3,
      "refresh": "short_rest"
    }
  }
}
