{
  "name": "Spark",
  "type": "Spell",
  "description": "A short, spitting arc of light thrown from the fingertips. It singes more than it wounds, but it costs almost nothing to call.",
  "value": 80,
  "attributes": {
    "damageRoll": "1d6",
    "attackAttribute": "intelligence",
    "actionPoints": 1,
    "uses": {
      "max": 2,
      "refresh": "short_rest"
    }
  }
}
